{
  "diagnostics": [],
  "edges": [
    {
      "attributes": {},
      "source": "ndf://fixture/PIPE-ISSUE-010",
      "source_span": {
        "column": 1,
        "end_column": null,
        "end_line": null,
        "line": 20,
        "path": "docs/pipeline.md"
      },
      "target": "ndf://fixture/PIPE-ISSUE-001",
      "type": "refines"
    },
    {
      "attributes": {},
      "source": "ndf://fixture/PIPE-PTO-001",
      "source_span": {
        "column": 1,
        "end_column": null,
        "end_line": null,
        "line": 25,
        "path": "docs/pipeline.md"
      },
      "target": "ndf://pto-spec/PTO-INST-TILE-TLOAD",
      "type": "conforms-to"
    },
    {
      "attributes": {},
      "source": "ndf://fixture/PIPE-PTO-EXT-001",
      "source_span": {
        "column": 1,
        "end_column": null,
        "end_line": null,
        "line": 30,
        "path": "docs/pipeline.md"
      },
      "target": "ndf://pto-spec/PTO-INST-TILE-PEXT",
      "type": "tracks"
    }
  ],
  "nodes": [
    {
      "attributes": {
        "authority": "normative"
      },
      "body": "",
      "domain": null,
      "id": "ndf://fixture/DOC-FIXTURE-PIPELINE",
      "kind": "document",
      "modality": null,
      "owner": "core",
      "refinement": null,
      "source": {
        "column": 1,
        "end_column": null,
        "end_line": null,
        "line": 1,
        "path": "docs/pipeline.md"
      },
      "status": "active",
      "title": "Pipeline"
    },
    {
      "attributes": {},
      "body": "The core MUST issue no more than two instructions per cycle.",
      "domain": "core",
      "id": "ndf://fixture/PIPE-ISSUE-001",
      "kind": "requirement",
      "modality": "must",
      "owner": "core",
      "refinement": "L1",
      "source": {
        "column": 1,
        "end_column": null,
        "end_line": null,
        "line": 14,
        "path": "docs/pipeline.md"
      },
      "status": "active",
      "title": "Issue contract"
    },
    {
      "attributes": {},
      "body": "Two issue slots MUST arbitrate oldest-ready first.",
      "domain": "core",
      "id": "ndf://fixture/PIPE-ISSUE-010",
      "kind": "requirement",
      "modality": "must",
      "owner": "core",
      "refinement": "L2",
      "source": {
        "column": 1,
        "end_column": null,
        "end_line": null,
        "line": 19,
        "path": "docs/pipeline.md"
      },
      "status": "active",
      "title": "Issue mechanism"
    },
    {
      "attributes": {},
      "body": "The pipeline MUST preserve the PTO load contract.",
      "domain": "core",
      "id": "ndf://fixture/PIPE-PTO-001",
      "kind": "requirement",
      "modality": "must",
      "owner": "core",
      "refinement": "L1",
      "source": {
        "column": 1,
        "end_column": null,
        "end_line": null,
        "line": 24,
        "path": "docs/pipeline.md"
      },
      "status": "active",
      "title": "PTO conformance"
    },
    {
      "attributes": {
        "expected": "absent"
      },
      "body": "The extension remains outside the accepted PTO release.",
      "domain": "core",
      "id": "ndf://fixture/PIPE-PTO-EXT-001",
      "kind": "requirement",
      "modality": "tbd",
      "owner": "core",
      "refinement": "L1",
      "source": {
        "column": 1,
        "end_column": null,
        "end_line": null,
        "line": 29,
        "path": "docs/pipeline.md"
      },
      "status": "draft",
      "title": "Prospective PTO extension"
    }
  ],
  "schema_version": "0.1"
}
